{
  "schema_version": 1,
  "ledger_kind": "ra_current_observation_ledger",
  "ledger_role": "evidence_not_requirement",
  "task_0b_entry_binding": {
    "repository": "cc-gateway",
    "path": "docs/superpowers/evidence/p0-1/p0-1-entry-baseline.json",
    "digest": "sha256:e6d7426c63f8bf96a91de5c47d9fc6807fae5da68ad507e8ba65b93f2732f235"
  },
  "repository_commits": {
    "cc_gateway": {
      "repository": "cc-gateway",
      "commit": "c7404e36c576965a6177f6d25cd8657b6550261d"
    },
    "sub2api": {
      "repository": "sub2api",
      "commit": "d5a42bbd24d15af2ce7646d050a5ae5c77911d4f"
    }
  },
  "verifications": [
    {
      "verification_id": "OBS001-T",
      "repository": "cc-gateway",
      "cwd": ".",
      "argv": ["npm", "exec", "tsx", "tests/native-oracle-matrix.test.ts"],
      "environment_profile": "HERMETIC_NETWORK_ENV",
      "env": {},
      "expected_classification": "pass",
      "result_digest": "sha256:b82f4cb26f83c6496a9570f9f0cc5c830cd662a79b4fac6dfa0fb6564e89a6db"
    },
    {
      "verification_id": "OBS002-T1",
      "repository": "cc-gateway",
      "cwd": ".",
      "argv": ["npm", "exec", "tsx", "tests/persona-registry.test.ts"],
      "environment_profile": "HERMETIC_NETWORK_ENV",
      "env": {},
      "expected_classification": "pass",
      "result_digest": "sha256:543d329d1f557785ecdc84bf843db0b7c3d286f32991608e350769e37e8442e9"
    },
    {
      "verification_id": "OBS002-T2",
      "repository": "cc-gateway",
      "cwd": ".",
      "argv": ["npm", "exec", "tsx", "tests/formal-pool-canonical-promotion.test.ts"],
      "environment_profile": "HERMETIC_NETWORK_ENV",
      "env": {},
      "expected_classification": "pass",
      "result_digest": "sha256:21dec77d55f3a7a1917f925ae8329990f49082d440348656598da5abe95a12f4"
    },
    {
      "verification_id": "OBS003-G",
      "repository": "cc-gateway",
      "cwd": ".",
      "argv": ["codegraph", "explore", "handleRequest RawCaptureSink EgressSidecarStreamResponse pipe Buffer.concat"],
      "environment_profile": "INDEXED_CODEGRAPH",
      "env": {},
      "expected_classification": "anchors_present_no_outcome_envelope_owner",
      "result_digest": "sha256:f518831422a9dcb66cf56a24163e08399f7b75f96712159d5b94cbb7aad8b524"
    },
    {
      "verification_id": "OBS003-T",
      "repository": "cc-gateway",
      "cwd": ".",
      "argv": ["npm", "exec", "tsx", "tests/formal-pool-real-chain-mock-response.test.ts"],
      "environment_profile": "HERMETIC_NETWORK_ENV",
      "env": {},
      "expected_classification": "pass",
      "result_digest": "sha256:f5295670b35252ad5ccc795ad9375c0d289f15d0bee282457dccc8b847c4e0fe"
    },
    {
      "verification_id": "OBS004-SUB",
      "repository": "sub2api",
      "cwd": ".",
      "argv": ["codegraph", "explore", "FormalPoolCCGatewayRuntimeRegistrar RegisterCCGatewayRuntime freeze drain revoke delete query reconcile"],
      "environment_profile": "INDEXED_CODEGRAPH",
      "env": {},
      "expected_classification": "register_present_full_lifecycle_absent",
      "result_digest": "sha256:2cf5cb66abcb0ce6dbe00d003bbc9e9d8f29fc7ca90451c581818037b25f00c2"
    },
    {
      "verification_id": "OBS004-CC",
      "repository": "cc-gateway",
      "cwd": ".",
      "argv": ["codegraph", "explore", "RUNTIME_REGISTER_PATH sameRuntimeMappingAuthorityAllowingCredentialRotation isAllowedRuntimeCanonicalPromotion sameRuntimeMappingAuthorityAllowingTLSProfileBackfill"],
      "environment_profile": "INDEXED_CODEGRAPH",
      "env": {},
      "expected_classification": "limited_paths_present",
      "result_digest": "sha256:c318bc5e78eaa474f4a509a7d356abb6158a027ff59008845eb7a9c75f01ab96"
    },
    {
      "verification_id": "OBS005-CC",
      "repository": "cc-gateway",
      "cwd": ".",
      "argv": ["codegraph", "explore", "EgressSidecarControl Control replay nonce deadline body hash header hash attempt key epoch resolve classify pin dial"],
      "environment_profile": "INDEXED_CODEGRAPH",
      "env": {},
      "expected_classification": "capability_and_replay_fields_missing",
      "result_digest": "sha256:e56e2891aeb772282b8c9ce913f99cfa574331a23a13a2e5f095fccd52f20932"
    },
    {
      "verification_id": "OBS005-GO-RED",
      "repository": "cc-gateway",
      "cwd": "sidecar/egress-tls-sidecar",
      "argv": ["go", "test", "-tags=phase0red", "./internal/control", "./internal/server", "-count=1"],
      "environment_profile": "HERMETIC_NETWORK_ENV",
      "env": {},
      "expected_classification": "expected_fail_b5_b6",
      "result_digest": "sha256:903ef955061b27e2f801abc77be511507a73af5f4fd77f4a7601cbb312696909"
    },
    {
      "verification_id": "OBS006-SUB",
      "repository": "sub2api",
      "cwd": ".",
      "argv": ["codegraph", "explore", "ccGatewayGeneratedDeviceID ccGatewayDeviceID scopedStickyHMACBytes"],
      "environment_profile": "INDEXED_CODEGRAPH",
      "env": {},
      "expected_classification": "hmac_derived_id_path_present",
      "result_digest": "sha256:e62de8a011a13ef87dec1efa802271137d0dada421aafaa5e936421094186e2d"
    },
    {
      "verification_id": "OBS006-CC",
      "repository": "cc-gateway",
      "cwd": ".",
      "argv": ["codegraph", "explore", "normalizeRuntimeAccountMapping verifyProviderAwareFinalRequest device_id equality"],
      "environment_profile": "INDEXED_CODEGRAPH",
      "env": {},
      "expected_classification": "format_equality_present_issuer_verifier_absent",
      "result_digest": "sha256:e6efe08994eec5f942ccaccb74960d16133aeecb6a10be0b3af1a6dd3b554f8b"
    },
    {
      "verification_id": "OBS007-G",
      "repository": "cc-gateway",
      "cwd": ".",
      "argv": ["codegraph", "explore", "ProxyRuntimeState replayRuntimeMappings RUNTIME_MAPPING_FILE_ENV FORMAL_POOL_SESSION_LEDGER_FILE_ENV /_health"],
      "environment_profile": "INDEXED_CODEGRAPH",
      "env": {},
      "expected_classification": "process_map_local_file_authority_present",
      "result_digest": "sha256:d1fc2245e1089dbc0a103d3c897cb646bbb38fac17d2f8f971931cfd20fd64b2"
    },
    {
      "verification_id": "OBS007-T",
      "repository": "cc-gateway",
      "cwd": ".",
      "argv": ["npm", "exec", "tsx", "tests/health-verify.test.ts"],
      "environment_profile": "HERMETIC_NETWORK_ENV",
      "env": {},
      "expected_classification": "pass",
      "result_digest": "sha256:8e1ba19dccfd9f397b6d99e8af8de47ab437d65de4db15cac10bf326edc38174"
    },
    {
      "verification_id": "OBS008-G",
      "repository": "cc-gateway",
      "cwd": ".",
      "argv": ["codegraph", "explore", "Config server.host startProxy listenHost server.listen"],
      "environment_profile": "INDEXED_CODEGRAPH",
      "env": {},
      "expected_classification": "configured_host_passed_to_listen",
      "result_digest": "sha256:10b6a4bf50447b0a4f02114dc864fdd0733e218a527dc59dcd48e5e3b071eca0"
    },
    {
      "verification_id": "OBS008-T",
      "repository": "cc-gateway",
      "cwd": ".",
      "argv": ["npm", "exec", "tsx", "tests/security-boundary.test.ts"],
      "environment_profile": "HERMETIC_NETWORK_ENV",
      "env": {},
      "expected_classification": "pass_current_default_ipv6_any",
      "result_digest": "sha256:32783a541b3e4fb5b5ff1d6b0ccbcdbeff887ea6d8241b486694fa43edbf02a3"
    },
    {
      "verification_id": "OBS009-RED-A",
      "repository": "sub2api",
      "cwd": "backend",
      "argv": ["go", "test", "./internal/service", "-run", "^TestClaudePlatformAWSLocalFullChainE2EUsesCCGatewayAndSafeMockUpstream$", "-count=1", "-v"],
      "environment_profile": "HERMETIC_NETWORK_ENV",
      "env": { "CC_GATEWAY_REPO_ROOT": "${CC_GATEWAY_ROOT}" },
      "expected_classification": "expected_fail_gateway_compromise_boundary_required",
      "result_digest": "sha256:81857c3a5ae049e3d0b5ae428c7e9ade496fe6fecd1be47eed93907038b709a6"
    },
    {
      "verification_id": "OBS009-RED-B",
      "repository": "sub2api",
      "cwd": "backend",
      "argv": ["go", "test", "./internal/service", "-run", "^TestJointLocalCaptureAcceptanceArtifact$", "-count=1", "-v"],
      "environment_profile": "HERMETIC_NETWORK_ENV",
      "env": { "CC_GATEWAY_REPO_ROOT": "${CC_GATEWAY_ROOT}" },
      "expected_classification": "expected_fail_gateway_compromise_boundary_required",
      "result_digest": "sha256:e3486ec1622e88e1c0271078f62314aa30f7f2cbe579bd3dae70210839411b64"
    },
    {
      "verification_id": "OBS010-G",
      "repository": "cc-gateway",
      "cwd": ".",
      "argv": ["codegraph", "node", "src/proxy.ts"],
      "environment_profile": "INDEXED_CODEGRAPH",
      "env": {},
      "expected_classification": "one_4726_line_concentrated_owner_file",
      "result_digest": "sha256:2bcdb0ef3fc851912b9125475b5a4e21f0a184add288fb5d06cace523125f802"
    }
  ],
  "append_history": [
    {
      "sequence": 1,
      "appended_at": "2026-07-13T07:01:25Z",
      "previous_ledger_commit": null,
      "previous_ledger_digest": null,
      "previous_append_digest": null,
      "event_digests": [
        "sha256:9e38d7b3ddcfbffce392f023423a8ed25694f8f6db5aff29a4cb8ca7c59819a5",
        "sha256:743667290dc09dfd4732473c085286aaedb32b1067e08231420df022873beaa5",
        "sha256:4825a3ad5398c77df21dc214b9910712b2abbd3a67fcf7d36dfed1ed82781af3",
        "sha256:93caed593264583883bfeec8106771f466f92eb4074ca2c1630ad8c420c388b6",
        "sha256:4b107508de9f8f48072160cc92de1990d556b57d67fe4414d0c899ae9cb860c4",
        "sha256:350775b018573d2425b5809cffc4f4abfaf70679dfb2478bc8f8cbe291ff6369",
        "sha256:7db74c1f90d643eb009375a85abe23b2ae66a2f56393cbe5461cbf97b4ce205e",
        "sha256:19147d6da36eb762f4f4d632d35c1b1d9adf372f9036bfccd0884229a6b6d98e",
        "sha256:ffcc80bdc40b8f29694609230fedc9ad533bacde65b5413069aada2360de56c0",
        "sha256:722e30d1e04d70f1887c876d82339afd3fb70428f58812f9829bc2e115ac1372"
      ],
      "append_digest": "sha256:8760d1661678d690151302f2ee73e280c03c1938e79e03b64d1e5115a626cce3"
    },
    {
      "sequence": 2,